{
  "id": "p2-066",
  "part": "2",
  "number": "066",
  "year": 1991,
  "rarity": "standard",
  "title_jp": "悟空大活劇！",
  "title_en": "Goku's Great Adventure!",
  "title_fr": "La grande aventure de Goku !",
  "front_image_url": "https://fchavonet.github.io/full_stack-db_visual_adventure_cards_api/assets/images/front/part_2/part_2-066.webp",
  "back_image_url": "https://fchavonet.github.io/full_stack-db_visual_adventure_cards_api/assets/images/back/part_2/part_2-066.webp",
  "updated_at": "2026-08-25T13:11:54.260Z"
}
