{
  "id": "p1-026",
  "part": "1",
  "number": "026",
  "year": 1991,
  "rarity": "standard",
  "title_jp": "いってきま～す！",
  "title_en": "I’m leaving!",
  "title_fr": "J’y vais !",
  "front_image_url": "https://fchavonet.github.io/full_stack-db_visual_adventure_cards_api/assets/images/front/part_1-026.webp",
  "back_image_url": "https://fchavonet.github.io/full_stack-db_visual_adventure_cards_api/assets/images/back/part_1-026.webp",
  "updated_at": "2026-08-17T17:05:29.386Z"
}
