{
  "id": "p1-038",
  "part": "1",
  "number": "038",
  "year": 1991,
  "rarity": "standard",
  "title_jp": "ここはナメック星",
  "title_en": "This is Planet Namek",
  "title_fr": "Ici, c’est la planète Namek",
  "front_image_url": "https://fchavonet.github.io/full_stack-db_visual_adventure_cards_api/assets/images/front/part_1/part_1-038.webp",
  "back_image_url": "https://fchavonet.github.io/full_stack-db_visual_adventure_cards_api/assets/images/back/part_1/part_1-038.webp",
  "updated_at": "2026-08-25T10:29:06.860Z"
}
