{
  "id": "p2-047",
  "part": "2",
  "number": "047",
  "year": 1991,
  "rarity": "prism",
  "title_jp": "天下分け目の超決戦！",
  "title_en": "The ultimate decisive battle!",
  "title_fr": "Le combat décisif ultime !",
  "front_image_url": "https://fchavonet.github.io/full_stack-db_visual_adventure_cards-api/assets/images/front/part_2/part_2-047.webp",
  "back_image_url": "https://fchavonet.github.io/full_stack-db_visual_adventure_cards-api/assets/images/back/part_2/part_2-047.webp",
  "prism_mask_url": "https://fchavonet.github.io/full_stack-db_visual_adventure_cards-api/assets/images/mask/part_2/part_2-047.webp",
  "updated_at": "2026-08-25T19:05:07.879Z"
}
