{
  "id": "p3-111",
  "part": "3",
  "number": "111",
  "year": 1991,
  "rarity": "standard",
  "title_jp": "1対1の勝負！",
  "title_en": "A one-on-one showdown!",
  "title_fr": "Un duel en un contre un !",
  "front_image_url": "https://fchavonet.github.io/full_stack-db_visual_adventure_cards_api/assets/images/front/part_3/part_3-111.webp",
  "back_image_url": "https://fchavonet.github.io/full_stack-db_visual_adventure_cards_api/assets/images/back/part_3/part_3-111.webp",
  "updated_at": "2026-08-25T11:47:40.838Z"
}
