{
  "id": "p2-078",
  "part": "2",
  "number": "078",
  "year": 1991,
  "rarity": "standard",
  "title_jp": "ザーボンの怒り",
  "title_en": "Zarbon's anger",
  "title_fr": "La colère de Zarbon",
  "front_image_url": "https://fchavonet.github.io/full_stack-db_visual_adventure_cards_api/assets/images/front/part_2-078.webp",
  "back_image_url": "https://fchavonet.github.io/full_stack-db_visual_adventure_cards_api/assets/images/back/part_2-078.webp",
  "updated_at": "2026-08-17T17:05:29.402Z"
}
