{
  "id": "p1-035",
  "part": "1",
  "number": "035",
  "year": 1991,
  "rarity": "standard",
  "title_jp": "激闘開始",
  "title_en": "The fierce battle begins",
  "title_fr": "Le combat acharné commence",
  "front_image_url": "https://fchavonet.github.io/full_stack-db_visual_adventure_cards_api/assets/images/front/part_1/part_1-035.webp",
  "back_image_url": "https://fchavonet.github.io/full_stack-db_visual_adventure_cards_api/assets/images/back/part_1/part_1-035.webp",
  "updated_at": "2026-08-25T11:47:40.819Z"
}
