{
  "id": "p1-034",
  "part": "1",
  "number": "034",
  "year": 1991,
  "rarity": "standard",
  "title_jp": "ちょっとひとやすみ",
  "title_en": "Let’s take a short rest",
  "title_fr": "On fait une petite pause",
  "front_image_url": "https://fchavonet.github.io/full_stack-db_visual_adventure_cards-api/assets/images/front/part_1/part_1-034.webp",
  "back_image_url": "https://fchavonet.github.io/full_stack-db_visual_adventure_cards-api/assets/images/back/part_1/part_1-034.webp",
  "updated_at": "2026-08-25T19:05:07.873Z"
}
