{
  "id": "p3-119",
  "part": "3",
  "number": "119",
  "year": 1991,
  "rarity": "standard",
  "title_jp": "ザーボンVSベジータ",
  "title_en": "Zarbon VS Vegeta",
  "title_fr": "Zarbon contre Vegeta",
  "front_image_url": "https://fchavonet.github.io/full_stack-db_visual_adventure_cards_api/assets/images/front/part_3/part_3-119.webp",
  "back_image_url": "https://fchavonet.github.io/full_stack-db_visual_adventure_cards_api/assets/images/back/part_3/part_3-119.webp",
  "updated_at": "2026-08-25T11:47:40.838Z"
}
