{
  "id": "p1-029",
  "part": "1",
  "number": "029",
  "year": 1991,
  "rarity": "standard",
  "title_jp": "到着",
  "title_en": "Arrival",
  "title_fr": "Arrivée",
  "front_image_url": "https://fchavonet.github.io/full_stack-db_visual_adventure_cards_api/assets/images/front/part_1-029.webp",
  "back_image_url": "https://fchavonet.github.io/full_stack-db_visual_adventure_cards_api/assets/images/back/part_1-029.webp",
  "updated_at": "2026-08-17T17:05:29.387Z"
}
