{
  "id": "p2-051",
  "part": "2",
  "number": "051",
  "year": 1991,
  "rarity": "standard",
  "title_jp": "かかってこいや！",
  "title_en": "Bring it on!",
  "title_fr": "Viens te battre !",
  "front_image_url": "https://fchavonet.github.io/full_stack-db_visual_adventure_cards_api/assets/images/front/part_2/part_2-051.webp",
  "back_image_url": "https://fchavonet.github.io/full_stack-db_visual_adventure_cards_api/assets/images/back/part_2/part_2-051.webp",
  "updated_at": "2026-08-25T13:11:54.255Z"
}
