{
  "id": "p2-068",
  "part": "2",
  "number": "068",
  "year": 1991,
  "rarity": "standard",
  "title_jp": "つかまってろよ！",
  "title_en": "Hang on!",
  "title_fr": "Accroche-toi !",
  "front_image_url": "https://fchavonet.github.io/full_stack-db_visual_adventure_cards_api/assets/images/front/part_2/part_2-068.webp",
  "back_image_url": "https://fchavonet.github.io/full_stack-db_visual_adventure_cards_api/assets/images/back/part_2/part_2-068.webp",
  "updated_at": "2026-08-25T13:11:54.260Z"
}
