{
  "id": "p2-071",
  "part": "2",
  "number": "071",
  "year": 1991,
  "rarity": "standard",
  "title_jp": "パワーアップ！",
  "title_en": "Power up!",
  "title_fr": "Puissance maximale !",
  "front_image_url": "https://fchavonet.github.io/full_stack-db_visual_adventure_cards_api/assets/images/front/part_2/part_2-071.webp",
  "back_image_url": "https://fchavonet.github.io/full_stack-db_visual_adventure_cards_api/assets/images/back/part_2/part_2-071.webp",
  "updated_at": "2026-08-25T09:35:44.858Z"
}
