{
  "id": "p2-053",
  "part": "2",
  "number": "053",
  "year": 1991,
  "rarity": "standard",
  "title_jp": "射てーっ！",
  "title_en": "Fire!",
  "title_fr": "Feu !",
  "front_image_url": "https://fchavonet.github.io/full_stack-db_visual_adventure_cards_api/assets/images/front/part_2/part_2-053.webp",
  "back_image_url": "https://fchavonet.github.io/full_stack-db_visual_adventure_cards_api/assets/images/back/part_2/part_2-053.webp",
  "updated_at": "2026-08-25T11:47:40.824Z"
}
