{
  "id": "p3-122",
  "part": "3",
  "number": "122",
  "year": 1991,
  "rarity": "standard",
  "title_jp": "最長老の危機！",
  "title_en": "The Grand Elder in danger!",
  "title_fr": "Le Grand Ancêtre en danger !",
  "front_image_url": "https://fchavonet.github.io/full_stack-db_visual_adventure_cards_api/assets/images/front/part_3-122.webp",
  "back_image_url": "https://fchavonet.github.io/full_stack-db_visual_adventure_cards_api/assets/images/back/part_3-122.webp",
  "updated_at": "2026-08-23T11:51:44.055Z"
}
