{
  "id": "p3-103",
  "part": "3",
  "number": "103",
  "year": 1991,
  "rarity": "standard",
  "title_jp": "ピラフ一味の挑戦",
  "title_en": "The Pilaf Gang's challenge",
  "title_fr": "Le défi de la bande de Pilaf",
  "front_image_url": "https://fchavonet.github.io/full_stack-db_visual_adventure_cards-api/assets/images/front/part_3/part_3-103.webp",
  "back_image_url": "https://fchavonet.github.io/full_stack-db_visual_adventure_cards-api/assets/images/back/part_3/part_3-103.webp",
  "updated_at": "2026-08-25T19:05:07.898Z"
}
