{
  "id": "p1-007",
  "part": "1",
  "number": "007",
  "year": 1991,
  "rarity": "standard",
  "title_jp": "冒険にいこう！",
  "title_en": "Let’s go on an adventure!",
  "title_fr": "Allons à l’aventure !",
  "front_image_url": "https://fchavonet.github.io/full_stack-db_visual_adventure_cards_api/assets/images/front/part_1/part_1-007.webp",
  "back_image_url": "https://fchavonet.github.io/full_stack-db_visual_adventure_cards_api/assets/images/back/part_1/part_1-007.webp",
  "updated_at": "2026-08-25T11:47:40.812Z"
}
