{
  "id": "p1-023",
  "part": "1",
  "number": "023",
  "year": 1991,
  "rarity": "standard",
  "title_jp": "第23回天下一武道会",
  "title_en": "23rd World Martial Arts Tournament",
  "title_fr": "23ᵉ Tournoi d'arts martiaux",
  "front_image_url": "https://fchavonet.github.io/full_stack-db_visual_adventure_cards_api/assets/images/front/part_1/part_1-023.webp",
  "back_image_url": "https://fchavonet.github.io/full_stack-db_visual_adventure_cards_api/assets/images/back/part_1/part_1-023.webp",
  "updated_at": "2026-08-25T11:47:40.816Z"
}
