{
  "id": "p2-048",
  "part": "2",
  "number": "048",
  "year": 1991,
  "rarity": "prism",
  "title_jp": "ギニュー特戦隊到着！",
  "title_en": "The Ginyu Force arrives!",
  "title_fr": "Le Commando Ginyu arrive !",
  "front_image_url": "https://fchavonet.github.io/full_stack-db_visual_adventure_cards-api/assets/images/front/part_2/part_2-048.webp",
  "back_image_url": "https://fchavonet.github.io/full_stack-db_visual_adventure_cards-api/assets/images/back/part_2/part_2-048.webp",
  "prism_mask_url": "https://fchavonet.github.io/full_stack-db_visual_adventure_cards-api/assets/images/mask/part_2/part_2-048.webp",
  "updated_at": "2026-08-25T19:05:07.880Z"
}
