{
  "id": "p1-042",
  "part": "1",
  "number": "042",
  "year": 1991,
  "rarity": "standard",
  "title_jp": "ディナータイム",
  "title_en": "Dinner time",
  "title_fr": "L’heure du dîner",
  "front_image_url": "https://fchavonet.github.io/full_stack-db_visual_adventure_cards_api/assets/images/front/part_1-042.webp",
  "back_image_url": "https://fchavonet.github.io/full_stack-db_visual_adventure_cards_api/assets/images/back/part_1-042.webp",
  "updated_at": "2026-08-23T11:51:44.026Z"
}
