{
  "id": "p1-037",
  "part": "1",
  "number": "037",
  "year": 1991,
  "rarity": "standard",
  "title_jp": "地球よ、オラに力を！",
  "title_en": "Earth, lend me your energy!",
  "title_fr": "Terre, prête-moi ton énergie !",
  "front_image_url": "https://fchavonet.github.io/full_stack-db_visual_adventure_cards_api/assets/images/front/part_1/part_1-037.webp",
  "back_image_url": "https://fchavonet.github.io/full_stack-db_visual_adventure_cards_api/assets/images/back/part_1/part_1-037.webp",
  "updated_at": "2026-08-25T11:47:40.820Z"
}
