{
  "id": "p2-049",
  "part": "2",
  "number": "049",
  "year": 1991,
  "rarity": "standard",
  "title_jp": "大格闘！",
  "title_en": "A great battle!",
  "title_fr": "Un grand combat !",
  "front_image_url": "https://fchavonet.github.io/full_stack-db_visual_adventure_cards_api/assets/images/front/part_2/part_2-049.webp",
  "back_image_url": "https://fchavonet.github.io/full_stack-db_visual_adventure_cards_api/assets/images/back/part_2/part_2-049.webp",
  "updated_at": "2026-08-25T09:35:44.851Z"
}
