{
  "id": "p2-074",
  "part": "2",
  "number": "074",
  "year": 1991,
  "rarity": "standard",
  "title_jp": "ついに対決の時",
  "title_en": "At last, the time for the showdown",
  "title_fr": "Enfin, l’heure de l’affrontement",
  "front_image_url": "https://fchavonet.github.io/full_stack-db_visual_adventure_cards_api/assets/images/front/part_2-074.webp",
  "back_image_url": "https://fchavonet.github.io/full_stack-db_visual_adventure_cards_api/assets/images/back/part_2-074.webp",
  "updated_at": "2026-08-17T17:05:29.401Z"
}
