{
  "id": "p1-001",
  "part": "1",
  "number": "001",
  "year": 1991,
  "rarity": "prism",
  "title_jp": "宝ものはいただきだ！",
  "title_en": "I'll take that treasure!",
  "title_fr": "Je prends ce trésor !",
  "front_image_url": "https://fchavonet.github.io/full_stack-db_visual_adventure_cards_api/assets/images/front/part_1/part_1-001.webp",
  "back_image_url": "https://fchavonet.github.io/full_stack-db_visual_adventure_cards_api/assets/images/back/part_1/part_1-001.webp",
  "updated_at": "2026-08-25T09:35:44.823Z"
}
